id,Title,Author,URL,Bibliography,In text,Brief summary,Use?

Find exactly 5 sources that are related to the background of your topic
Places to look: ANYWHERE
Social Media, News Channels, Newspapers, Blogs, etc.
You can look at Wikipedia but do not include wikipedia as a source
Rationale: These sources will provide some insight into what is already known about your topic and could possibly link you to previous studies that are cited casually in the public.
Use these to drive the timeliness of your paper.
Use these sources to drive the value of your paper.

1,"UX Design and Agile: A Natural Fit?","","","","","",""
2,"A Strategic Approach to Metrics for User Experience Designers","","","","","",""
3,"Componentizing the Web","","","","","",""
4,"Sample Size in usability Studies","","","","","",""
5,"the evolution of Web Development for mobile Devices","","","","","",""
6,"Max of 5: decision on exact sources will be made with time.","n/a","n/a","n/a","n/a","n/a","n/a"
7,"Why Agile Teams Fail Without UX Research","","","","","",""
8,"You've got to sweat the small stuff","","","","","",""